"BmpId","BmpShortName","BmpFullName","BmpCategoryId","BmpDetails","ParentBmpId","ParentBmpFullName","BmpGroupId","BmpTypeId"
61,urbanforplant,Forest Planting,1,"Urban forest planting includes trees planted in a contiguous area to establish forest-like conditions, with minimal mowing as needed to aid tree and understory establishment. Do not include plantings used to establish riparian forest buffers. Trees are planted on pervious areas. Enter units of acres or percent.",61,Tree Planting - Forest,77,1
62,urbantreeplant,Tree Planting - Canopy,1,"Tree plantings on developed land (turf grass or impervious) that result in an increase in tree canopy but are not intended to result in forest-like conditions. If source data are in a count of trees, consider 300 trees equivalent to one acre. Enter units of acres or percent.",62,Tree Planting - Canopy,76,1
63,dirtgraveldsaout,Dirt & Gravel Road Erosion & Sediment Control - Driving Surface Aggregate with Outlets,1,"Reduce the amount of sediment runoff from dirt and gravel roads through the use of driving surface aggregates (DSA) such as durable and erosion resistant road surface and through the use of additional Drainage Outlets (creating new outlets in ditchline to reduce channelized flow). Where specific design is unknown, use the BMP with outlets only. Enter units of feet.",64,,73,4
64,dirtgravelnodsa,Dirt & Gravel Road Erosion & Sediment Control - Outlets only,1,"Reduce the amount of sediment runoff from dirt and gravel roads through the use of additional Drainage Outlets (creating new outlets in ditchline to reduce channelized flow). Where specific design is unknown, use this BMP with outlets only. Enter units of feet.",64,Dirt & Gravel Road Erosion & Sediment Control,73,4
65,grassbuffnarrow,Grass Buffer - Narrow,1,"Grass buffers are linear strips of grass or other non-woody vegetation maintained to help filter nutrients, sediment and other pollutants from runoff.  Narrow buffer width is between 10 and 35 feet.  Enter units of acres or percent.",65,Grass Buffer-Upland Crops and Hay,14,1
66,forestbuffnarrow,Forest Buffer - Narrow,1,"Forest buffers are linear wooded areas that help filter nutrients, sediments and other pollutants from runoff as well as remove nutrients from groundwater.  Narrow buffer width is between 10 and 35 feet.  Enter units of acres or percent.",66,Forest Buffer-Upland Crops and Hay,15,1
67,barnrunoffcont,Barnyard Runoff Control,1,"Includes the installation of practices to control runoff from barnyard areas.  This includes practices such as roof runoff control, diversion of clean water from entering the barnyard and control of runoff from barnyard areas.  Enter units of acres or percent.",67,Barnyard Runoff Control,48,3
68,loaflot,Loafing Lot Management,1,"The stabilization of areas frequently and intensively used by people, animals or vehicles by establishing vegetative cover, surfacing with suitable materials, and/or installing needed structures.  This does not include poultry pad installation.  Enter units of acres or percent.",68,Loafing Lot Management,48,3
69,poultred,Poultry Nutrient Reduction,2,"Poultry manure nutrient concentrations are reduced due to feed additives or other technological enhancements. Phytase is not included as it is already assumed in the manure nutrient concentrations.  Enter units of percent, number of animals or number of animal units.",69,Poultry Nutrient Reduction,81,5
70,ditchbioreactors,Denitrifying Ditch Bioreactors,1,Diversion of tile-line flow through a carbon-source filter to enhance conversion of nitrate to nitrogen gas that volatilizes. Enter units of length or acres treated.,70,Ditch Diversions,96,3
71,dairyprecfeed,Dairy Precision Feeding and/or Forage Management,2,"Dairy Precision Feeding reduces the quantity of phosphorus and nitrogen fed to livestock by formulating diets within 110% of Nutritional Research Council recommended level in order to minimize the excretion of nutrients without negatively affecting milk production.  Enter units of percent, number of animals or number of animal units.",71,Dairy Precision Feeding and/or Forage Management,81,5
72,covercroptradwnd,Cover Crop Traditional Wheat Normal Drilled,1,A short-term crop grown after the main cropping season that reduces nutrient losses to ground and surface water by sequestering nutrients. Wheat cover crop is planted no more than 2 weeks prior to the average frost date with a drilled seeding method. Fall nutrients are not applied and the crop may not be harvested in the spring. Enter units of acres or percent.,83,,43,3
73,covercroptradwno,Cover Crop Traditional Wheat Normal Other,1,A short-term crop grown after the main cropping season that reduces nutrient losses to ground and surface water by sequestering nutrients. Wheat cover crop is planted no more than 2 weeks prior to the average frost date with neither a drilled nor aerial seeding method. Fall nutrients are not applied and the crop may not be harvested in the spring. Enter units of acres or percent.,83,,43,3
74,bioretudab,"Bioretention/raingardens - A/B soils, underdrain",1,"An excavated pit backfilled with engineered media, topsoil, mulch, and vegetation.  These are planting areas installed in shallow basins in which the storm water runoff is temporarily ponded and then treated by filtering through the bed components, and through biological and biochemical reactions within the soil matrix and around the root zones of the plants.  This BMP has an underdrain and is in A or B soil. Enter unit of total acres treated or percent of acres treated.",178,,42,3
75,bioswale,Bioswale,1,"With a bioswale, the load is reduced because, unlike other open channel designs, there is now infiltration into the soil.  A bioswale is designed to function as a bioretention area. Enter unit of total acres treated or percent of acres treated.",75,Bioswale,42,3
76,permpavsvudab,"Permeable Pavement w/ Sand, Veg. - A/B soils, underdrain",1,"Pavement or pavers that reduce runoff volume and treat water quality through both infiltration and filtration mechanisms.  Water filters through open voids in the pavement surface to a washed gravel subsurface storage reservoir, where it is then slowly infiltrated into the underlying soils or exits via an underdrain.  This BMP has an underdrain, has sand and/or vegetation and is in A or B soil. Enter unit of total acres treated or percent of acres treated.",174,,42,3
77,permpavnosvudab,"Permeable Pavement w/o Sand, Veg. - A/B soils, underdrain",1,"Pavement or pavers that reduce runoff volume and treat water quality through both infiltration and filtration mechanisms.  Water filters through open voids in the pavement surface to a washed gravel subsurface storage reservoir, where it is then slowly infiltrated into the underlying soils or exits via an underdrain.  This BMP has an underdrain, no sand or vegetation and is in A or B soil. Enter unit of total acres treated or percent of acres treated.",174,,42,3
78,vegopchannoudab,"Vegetated Open Channels - A/B soils, no underdrain",1,"Open channels are practices that convey stormwater runoff and provide treatment as the water is conveyed.  Runoff passes through either vegetation in the channel, subsoil matrix, and/or is infiltrated into the underlying soils. This BMP has no underdrain and is in A or B soil. Use this BMP where specific design is unknown. Enter unit of total acres treated or percent of acres treated.",78,Vegetated Open Channels,42,3
79,injection,Manure Injection,1,Manure is incorporated into the soil immediately. Enter units of acres or percent.,84,,98,3
80,covercroptradwld,Cover Crop Traditional Wheat Late Drilled,1,A short-term crop grown after the main cropping season that reduces nutrient losses to ground and surface water by sequestering nutrients. Wheat cover crop is planted after the average frost date with a drilled seeding method. Fall nutrients are not applied and the crop may not be harvested in the spring. Enter units of acres or percent.,83,,43,3
81,incorplowearly,Manure Incorporation Low Disturbance Early,1,Manure is incorporated into the soil within 24 hours of application with less than 40% soil disturbance. Enter units of acres or percent.,84,,98,3
82,incorphighearly,Manure Incorporation High Disturbance Early,1,Manure is incorporated into the soil within 24 hours of application. The level of soil disturbance is assumed to be high. Enter units of acres or percent.,85,,98,3
83,covercroptradwlo,Cover Crop Traditional Wheat Late Other,1,A short-term crop grown after the main cropping season that reduces nutrient losses to ground and surface water by sequestering nutrients. Wheat cover crop is planted after the average frost date with neither a drilled nor aerial seeding method. Fall nutrients are not applied and the crop may not be harvested in the spring. Use this BMP where the planting time and species are unknown. Enter units of acres or percent.,83,Cover Crop,43,3
84,incorplowlate,Manure Incorporation Low Disturbance Late,1,Manure is incorporated into the soil between 1 and 3 days of application with less than 40% soil disturbance. Enter units of acres or percent.,84,Manure Incorporation Low,98,3
85,incorphighlate,Manure Incorporation High Disturbance Late,1,Manure is incorporated into the soil within 1 and 3 days of application. The level of soil disturbance is assumed to be high. Enter units of acres or percent.,85,Manure Incorporation High,98,3
86,covercroptradbed,Cover Crop Traditional Barley Early Drilled,1,A short-term crop grown after the main cropping season that reduces nutrient losses to ground and surface water by sequestering nutrients. Barley cover crop is planted at least 2 weeks prior to the average frost date with a drilled seeding method. Fall nutrients are not applied and the crop may not be harvested in the spring. Enter units of acres or percent.,83,,43,3
87,shoreagnoveg,Non Urban Shoreline Erosion Control Non-Vegetated,1,"Practices without a vegetated area along agriculturally-dominated tidal shorelines that prevent and/or reduces tidal sediments to the Bay. Shoreline practices can include living shorelines, revetments and/or breakwater systems and bulkheads and seawalls. Only report practices installed after 12/31/2007. Shoreline BMPs before 2008 are automatically credited. Input units of feet and acres. If only feet are known, use the Shoreline Management BMP that does not specify vegetative conditions.",26,,72,4
88,shoreagveg,Non Urban Shoreline Erosion Control Vegetated,1,"Practices with a vegetated area along agriculturally-dominated tidal shorelines that prevent and/or reduces tidal sediments to the Bay. Shoreline practices can include living shorelines, revetments and/or breakwater systems and bulkheads and seawalls. Only report practices installed after 12/31/2007. Shoreline BMPs before 2008 are automatically credited. Input units of feet and acres. If only feet are known, use the Shoreline Management BMP that does not specify vegetative conditions.",26,,72,4
89,shoreurbnoveg,Urban Shoreline Erosion Control Non-Vegetated,1,"Practices without a vegetated area along urban-dominated tidal shorelines that prevent and/or reduces tidal sediments to the Bay. Shoreline practices can include living shorelines, revetments and/or breakwater systems and bulkheads and seawalls. Only report practices installed after 12/31/2007. Shoreline BMPs before 2008 are automatically credited. Input units of feet and acres. If only feet are known, use the Shoreline Management BMP that does not specify vegetative conditions.",26,,72,4
90,shoreurbveg,Urban Shoreline Erosion Control Vegetated,1,"Practices with a vegetated area along urban-dominated tidal shorelines that prevent and/or reduces tidal sediments to the Bay. Shoreline practices can include living shorelines, revetments and/or breakwater systems and bulkheads and seawalls. Only report practices installed after 12/31/2007. Shoreline BMPs before 2008 are automatically credited. Input units of feet and acres. If only feet are known, use the Shoreline Management BMP that does not specify vegetative conditions.",26,,72,4
91,tideaft,Algal Flow-way Tidal,1,Algal flow-way technologies are inclined race-ways in tidal waters that receive nutrient-laden water so natural algal assemblages can accumulate and then be harvested for an end use. Enter units of acres only.,93,,72,4
92,tideaftmon,Algal Flow-way Tidal Monitored,1,"Algal flow-way technologies are inclined race-ways in tidal waters that receive nutrient-laden water so natural algal assemblages can accumulate and then be harvested for an end use. Inflow/outflow biomass monitoring is required. Enter units of acres and pounds of TN, TP, or TSS.",93,,72,4
93,nontideaft,Algal Flow-way Non-Tidal,1,"Algal flow-way technologies are inclined race-ways in non-tidal waters that receive nutrient-laden water so natural algal assemblages can accumulate and then be harvested for an end use. Where tidal conditions are not known, use this BMP. Enter units of acres only.",93,Algal Flow-way,74,4
94,nontideaftmon,Algal Flow-way  Non-Tidal Monitored,1,"Algal flow-way technologies are inclined race-ways in non-tidal waters that receive nutrient-laden water so natural algal assemblages can accumulate and then be harvested for an end use. Inflow/outflow biomass monitoring is required. Enter units of acres and pounds of TN, TP, or TSS.",93,,74,4
95,covercroptradnutohnd,"Cover Crop Traditional with Fall Nutrients Oats, Winter Hardy Normal Drilled",1,A short-term crop grown after the main cropping season that reduces nutrient losses to ground and surface water by sequestering nutrients. Oats cover crop is planted no more than 2 weeks prior to the average frost date with a drilled seeding method on cropland where manure is applied following the harvest of a summer crop and prior to cover crop planting. The crop may not be harvested in the spring. Enter units of acres or percent.,238,,43,3
96,covercroptradbeo,Cover Crop Traditional Barley Early Other,1,A short-term crop grown after the main cropping season that reduces nutrient losses to ground and surface water by sequestering nutrients. Barley cover crop is planted at least 2 weeks prior to the average frost date with neither a drilled nor aerial seeding method. Fall nutrients are not applied and the crop may not be harvested in the spring. Enter units of acres or percent.,83,,43,3
97,covercroptradbea,Cover Crop Traditional Barley Early Aerial,1,A short-term crop grown after the main cropping season that reduces nutrient losses to ground and surface water by sequestering nutrients. Barley cover crop is planted at least 2 weeks prior to the average frost date with a aerial seeding method. Fall nutrients are not applied and the crop may not be harvested in the spring. Enter units of acres or percent.,83,,43,3
98,covercroptradbnd,Cover Crop Traditional Barley Normal Drilled,1,A short-term crop grown after the main cropping season that reduces nutrient losses to ground and surface water by sequestering nutrients. Barley cover crop is planted no more than 2 weeks prior to the average frost date with a drilled seeding method. Fall nutrients are not applied and the crop may not be harvested in the spring. Enter units of acres or percent.,83,,43,3
99,covercroptradbno,Cover Crop Traditional Barley Normal Other,1,A short-term crop grown after the main cropping season that reduces nutrient losses to ground and surface water by sequestering nutrients. Barley cover crop is planted no more than 2 weeks prior to the average frost date with neither a drilled nor aerial seeding method. Fall nutrients are not applied and the crop may not be harvested in the spring. Enter units of acres or percent.,83,,43,3
100,ftw1,Floating Treatment Wetland 10% Coverage of Pond,1,"Floating treatment wetlands are rafts of wetland vegetation deployed in existing wet ponds with a drainage area of <400 acres. First report wet ponds or stormwater performance standard-stormwater treatment (ST), then report the BMP according to the percent of pond area covered in the wetland rafts. Report units of acres treated by the wet pond.",100,Floating Treatment Wetland,47,3
101,ftw2,Floating Treatment Wetland 20% Coverage of Pond,1,"Floating treatment wetlands are rafts of wetland vegetation deployed in existing wet ponds with a drainage area of <400 acres. First report wet ponds or stormwater performance standard-stormwater treatment (ST), then report the BMP according to the percent of pond area covered in the wetland rafts. Report units of acres treated by the wet pond.",100,,47,3
102,ftw3,Floating Treatment Wetland 30% Coverage of Pond,1,"Floating treatment wetlands are rafts of wetland vegetation deployed in existing wet ponds with a drainage area of <400 acres. First report wet ponds or stormwater performance standard-stormwater treatment (ST), then report the BMP according to the percent of pond area covered in the wetland rafts. Report units of acres treated by the wet pond.",100,,47,3
103,ftw4,Floating Treatment Wetland 40% Coverage of Pond,1,"Floating treatment wetlands are rafts of wetland vegetation deployed in existing wet ponds with a drainage area of <400 acres. First report wet ponds or stormwater performance standard-stormwater treatment (ST), then report the BMP according to the percent of pond area covered in the wetland rafts. Report units of acres treated by the wet pond.",100,,47,3
104,ftw5,Floating Treatment Wetland 50% Coverage of Pond,1,"Floating treatment wetlands are rafts of wetland vegetation deployed in existing wet ponds with a drainage area of <400 acres. First report wet ponds or stormwater performance standard-stormwater treatment (ST), then report the BMP according to the percent of pond area covered in the wetland rafts. Report units of acres treated by the wet pond.",100,,47,3
105,covercroptradnutohno,"Cover Crop Traditional with Fall Nutrients Oats, Winter Hardy Normal Other",1,A short-term crop grown after the main cropping season that reduces nutrient losses to ground and surface water by sequestering nutrients. Oats cover crop is planted no more than 2 weeks prior to the average frost date with a seeding method other than drilled on cropland where manure is applied following the harvest of a summer crop and prior to cover crop planting. The crop may not be harvested in the spring. Enter units of acres or percent.,238,,43,3
106,covercroptradfed,Cover Crop Traditional Forage Radish Early Drilled,1,A short-term crop grown after the main cropping season that reduces nutrient losses to ground and surface water by sequestering nutrients. Forage radish cover crop is planted at least 2 weeks prior to the average frost date with a drilled seeding method. Fall nutrients are not applied and the crop may not be harvested in the spring. Enter units of acres or percent.,83,,43,3
107,covercroptradfeo,Cover Crop Traditional Forage Radish Early Other,1,A short-term crop grown after the main cropping season that reduces nutrient losses to ground and surface water by sequestering nutrients. Forage radish cover crop is planted at least 2 weeks prior to the average frost date with neither a drilled nor aerial seeding method. Fall nutrients are not applied and the crop may not be harvested in the spring. Enter units of acres or percent.,83,,43,3
108,capturereuse,Irrigation Water Capture Reuse,1,"In container nursery operations, runoff of irrigation water and leachate from plant containers grown on plastic or in greenhouses is routed to lined return ditches or piped to lined holding ponds. Ponds are designed to retain all excess irrigation water runoff or leachate and capture the first one-half to one-inch of stormwater runoff. Water is recirculated for irrigation in nursery and greenhouse operations or irrigated at the proper times of year on other vegetation capable of trapping nutrients at agronomic rates, such as cool season grasses.  Enter units of acres or percent.",108,Irrigation Water Capture Reuse,114,3
109,covercropcomearly,Cover Crop Commodity Early,1,A winter cereal crop planted for harvest in the spring that does not receive any fall nutrient applications. The crop is planted at least 2 weeks prior to the average frost date. Enter units of acres or percent.,110,,43,3
110,covercropcomnormal,Cover Crop Commodity Normal,1,A winter cereal crop planted for harvest in the spring that does not receive any fall nutrient applications. The crop is planted 2 weeks prior to the average frost date. Use this BMP where plant date is unknown. Enter units of acres or percent.,110,Commodity Cover Crop,43,3
111,covercropcomlate,Cover Crop Commodity Late,1,A winter cereal crop planted for harvest in the spring that does not receive any fall nutrient applications. The crop is planted at least 2 weeks after the average frost date. Enter units of acres or percent.,110,,43,3
112,covercroptradnutarno,Cover Crop Traditional with Fall Nutrients Annual Ryegrass Normal Other,1,A short-term crop grown after the main cropping season that reduces nutrient losses to ground and surface water by sequestering nutrients. Ryegrass cover crop is planted no more than 2 weeks prior to the average frost date with a seeding method other than drilled on cropland where manure is applied following the harvest of a summer crop and prior to cover crop planting. The crop may not be harvested in the spring. Enter units of acres or percent.,238,,43,3
113,covercroptradnutohed,"Cover Crop Traditional with Fall Nutrients Oats, Winter Hardy Early Drilled",1,A short-term crop grown after the main cropping season that reduces nutrient losses to ground and surface water by sequestering nutrients. Oats cover crop is planted at least 2 weeks prior to the average frost date with a drilled seeding method on cropland where manure is applied following the harvest of a summer crop and prior to cover crop planting. The crop may not be harvested in the spring. Enter units of acres or percent.,238,,43,3
114,covercroptradnutoheo,"Cover Crop Traditional with Fall Nutrients Oats, Winter Hardy Early Other",1,A short-term crop grown after the main cropping season that reduces nutrient losses to ground and surface water by sequestering nutrients. Oats cover crop is planted at least 2 weeks prior to the average frost date with a seeding method other than drilled on cropland where manure is applied following the harvest of a summer crop and prior to cover crop planting. The crop may not be harvested in the spring. Enter units of acres or percent.,238,,43,3
115,covercroptradfea,Cover Crop Traditional Forage Radish Early Aerial,1,A short-term crop grown after the main cropping season that reduces nutrient losses to ground and surface water by sequestering nutrients. Forage radish cover crop is planted at least 2 weeks prior to the average frost date with a aerial seeding method. Fall nutrients are not applied and the crop may not be harvested in the spring. Enter units of acres or percent.,83,,43,3
116,covercroptradfped,Cover Crop Traditional Forage Radish Plus Early Drilled,1,A short-term crop grown after the main cropping season that reduces nutrient losses to ground and surface water by sequestering nutrients. Forage radish cover crop is planted at least 2 weeks prior to the average frost date with a drilled seeding method. Fall nutrients are not applied and the crop may not be harvested in the spring. Enter units of acres or percent.,83,,43,3
117,covercroptradfpeo,Cover Crop Traditional Forage Radish Plus Early Other,1,A short-term crop grown after the main cropping season that reduces nutrient losses to ground and surface water by sequestering nutrients. Forage radish cover crop is planted at least 2 weeks prior to the average frost date with neither a drilled nor aerial seeding method. Fall nutrients are not applied and the crop may not be harvested in the spring. Enter units of acres or percent.,83,,43,3
118,covercroptradfpea,Cover Crop Traditional Forage Radish Plus Early Aerial,1,A short-term crop grown after the main cropping season that reduces nutrient losses to ground and surface water by sequestering nutrients. Forage radish cover crop is planted at least 2 weeks prior to the average frost date with a aerial seeding method. Fall nutrients are not applied and the crop may not be harvested in the spring. Enter units of acres or percent.,83,,43,3
119,ditchfilter,Sorbing Materials in Ag Ditches,1,Application of gypsum or other phosphorus-sorbing materials  in channel engineered systems that sorb available dissolved phosphorus in cropland drainage systems for removal and reuse as an agricultural fertilizer. Enter units of acres or percent.,36,,97,3
120,saturatedbuffer,Saturated Buffer,1,"Diversion of tile-line flow to a subsurface, perforated distribution pipe used to divert and spread drainage system discharge to a vegetated area to increase soil saturation. Enter units of length or acres of buffer.",70,,95,1
121,saturatedbuffereff,Saturated Buffers Upland Acres,1,"Upland area credited with a nitrogen, phosphorus and sediment load reduction as part of a saturated buffer installation.  Acres of the upland area credited are determined by the acres entered as a land use change.",121,Saturated Buffers Upland Acres,22,3
122,covercroptradfpnd,Cover Crop Traditional Forage Radish Plus Normal Drilled,1,A short-term crop grown after the main cropping season that reduces nutrient losses to ground and surface water by sequestering nutrients. Forage radish cover crop is planted no more than 2 weeks prior to the average frost date with a drilled seeding method. Fall nutrients are not applied and the crop may not be harvested in the spring. Enter units of acres or percent.,83,,43,3
