"BmpId","BmpShortName","BmpFullName","BmpCategoryId","BmpDetails","ParentBmpId","ParentBmpFullName","BmpGroupId","BmpTypeId"
240,covercroptradnutbeo,Cover Crop Traditional with Fall Nutrients Barley Early Other,1,A short-term crop grown after the main cropping season that reduces nutrient losses to ground and surface water by sequestering nutrients. Barley cover crop is planted at least 2 weeks prior to the average frost date with a seeding method other than drilled on cropland where manure is applied following the harvest of a summer crop and prior to cover crop planting. The crop may not be harvested in the spring. Enter units of acres or percent.,238,,43,3
241,covercroptradnutbnd,Cover Crop Traditional with Fall Nutrients Barley Normal Drilled,1,A short-term crop grown after the main cropping season that reduces nutrient losses to ground and surface water by sequestering nutrients. Barley cover crop is planted no more than 2 weeks prior to the average frost date with a drilled seeding method on cropland where manure is applied following the harvest of a summer crop and prior to cover crop planting. The crop may not be harvested in the spring. Enter units of acres or percent.,238,,43,3
242,covercroptradnutbno,Cover Crop Traditional with Fall Nutrients Barley Normal Other,1,A short-term crop grown after the main cropping season that reduces nutrient losses to ground and surface water by sequestering nutrients. Barley cover crop is planted no more than 2 weeks prior to the average frost date with a seeding method other than drilled on cropland where manure is applied following the harvest of a summer crop and prior to cover crop planting. The crop may not be harvested in the spring. Enter units of acres or percent.,238,,43,3
243,covercroptradnutfped,Cover Crop Traditional with Fall Nutrients Forage Radish Plus Early Drilled,1,A short-term crop grown after the main cropping season that reduces nutrient losses to ground and surface water by sequestering nutrients. Forage radish cover crop is planted at least 2 weeks prior to the average frost date with a drilled seeding method on cropland where manure is applied following the harvest of a summer crop and prior to cover crop planting. The crop may not be harvested in the spring. Enter units of acres or percent.,238,,43,3
244,covercroptradnutfpeo,Cover Crop Traditional with Fall Nutrients Forage Radish Plus Early Other,1,A short-term crop grown after the main cropping season that reduces nutrient losses to ground and surface water by sequestering nutrients. Forage radish cover crop is planted at least 2 weeks prior to the average frost date with a seeding method other than drilled on cropland where manure is applied following the harvest of a summer crop and prior to cover crop planting. The crop may not be harvested in the spring. Enter units of acres or percent.,238,,43,3
245,covercroptradnutfpnd,Cover Crop Traditional with Fall Nutrients Forage Radish Plus Normal Drilled,1,A short-term crop grown after the main cropping season that reduces nutrient losses to ground and surface water by sequestering nutrients. Forage radish cover crop is planted no more than 2 weeks prior to the average frost date with a drilled seeding method on cropland where manure is applied following the harvest of a summer crop and prior to cover crop planting. The crop may not be harvested in the spring. Enter units of acres or percent.,238,,43,3
246,covercroptradnutfpno,Cover Crop Traditional with Fall Nutrients Forage Radish Plus Normal Other,1,A short-term crop grown after the main cropping season that reduces nutrient losses to ground and surface water by sequestering nutrients. Forage radish cover crop is planted no more than 2 weeks prior to the average frost date with a seeding method other than drilled on cropland where manure is applied following the harvest of a summer crop and prior to cover crop planting. The crop may not be harvested in the spring. Enter units of acres or percent.,238,,43,3
247,covercroptradnutted,Cover Crop Traditional with Fall Nutrients Triticale Early Drilled,1,A short-term crop grown after the main cropping season that reduces nutrient losses to ground and surface water by sequestering nutrients. Triticale cover crop is planted at least 2 weeks prior to the average frost date with a drilled seeding method on cropland where manure is applied following the harvest of a summer crop and prior to cover crop planting. The crop may not be harvested in the spring. Enter units of acres or percent.,238,,43,3
248,covercroptradnutteo,Cover Crop Traditional with Fall Nutrients Triticale Early Other,1,A short-term crop grown after the main cropping season that reduces nutrient losses to ground and surface water by sequestering nutrients. Triticale cover crop is planted at least 2 weeks prior to the average frost date with a seeding method other than drilled on cropland where manure is applied following the harvest of a summer crop and prior to cover crop planting. The crop may not be harvested in the spring. Enter units of acres or percent.,238,,43,3
249,covercroptradnuttnd,Cover Crop Traditional with Fall Nutrients Triticale Normal Drilled,1,A short-term crop grown after the main cropping season that reduces nutrient losses to ground and surface water by sequestering nutrients. Triticale cover crop is planted no more than 2 weeks prior to the average frost date with a drilled seeding method on cropland where manure is applied following the harvest of a summer crop and prior to cover crop planting. The crop may not be harvested in the spring. Enter units of acres or percent.,238,,43,3
250,covercroptradnuttno,Cover Crop Traditional with Fall Nutrients Triticale Normal Other,1,A short-term crop grown after the main cropping season that reduces nutrient losses to ground and surface water by sequestering nutrients. Triticale cover crop is planted no more than 2 weeks prior to the average frost date with a seeding method other than drilled on cropland where manure is applied following the harvest of a summer crop and prior to cover crop planting. The crop may not be harvested in the spring. Enter units of acres or percent.,238,,43,3
251,covercroptradnuttld,Cover Crop Traditional with Fall Nutrients Triticale Late Drilled,1,A short-term crop grown after the main cropping season that reduces nutrient losses to ground and surface water by sequestering nutrients. Triticale cover crop is planted after the average first frost date with a drilled seeding method on cropland where manure is applied following the harvest of a summer crop and prior to cover crop planting. The crop may not be harvested in the spring. Enter units of acres or percent.,238,,43,3
252,covercroptradnuttlo,Cover Crop Traditional with Fall Nutrients Triticale Late Other,1,A short-term crop grown after the main cropping season that reduces nutrient losses to ground and surface water by sequestering nutrients. Triticale cover crop is planted after the average first frost date with a seeding method other than drilled on cropland where manure is applied following the harvest of a summer crop and prior to cover crop planting. The crop may not be harvested in the spring. Enter units of acres or percent.,238,,43,3
253,covercroptradnutared,Cover Crop Traditional with Fall Nutrients Annual Ryegrass Early Drilled,1,A short-term crop grown after the main cropping season that reduces nutrient losses to ground and surface water by sequestering nutrients. Ryegrass cover crop is planted at least 2 weeks prior to the average frost date with a drilled seeding method on cropland where manure is applied following the harvest of a summer crop and prior to cover crop planting. The crop may not be harvested in the spring. Enter units of acres or percent.,238,,43,3
254,covercroptradnutareo,Cover Crop Traditional with Fall Nutrients Annual Ryegrass Early Other,1,A short-term crop grown after the main cropping season that reduces nutrient losses to ground and surface water by sequestering nutrients. Ryegrass cover crop is planted at least 2 weeks prior to the average frost date with a seeding method other than drilled on cropland where manure is applied following the harvest of a summer crop and prior to cover crop planting. The crop may not be harvested in the spring. Enter units of acres or percent.,238,,43,3
255,covercroptradnutarnd,Cover Crop Traditional with Fall Nutrients Annual Ryegrass Normal Drilled,1,A short-term crop grown after the main cropping season that reduces nutrient losses to ground and surface water by sequestering nutrients. Ryegrass cover crop is planted no more than 2 weeks prior to the average frost date with a drilled seeding method on cropland where manure is applied following the harvest of a summer crop and prior to cover crop planting. The crop may not be harvested in the spring. Enter units of acres or percent.,238,,43,3
256,mtt1,Manure Treatment Slow Pyrolysis,3,"Manure organic matter converted in the absence of oxygen to produce char with a residence time of hours to days. Report units of dry tons and location where the manure is generated as ""county from"" and the location where the MTT product is applied as ""county to"".",256,Manure Treatment Technologies,85,6
257,mtt2,Manure Treatment Fast Pyrolysis,3,"Manure organic matter converted in the absence of oxygen to produce char with a residence time of seconds. Report units of dry tons and location where the manure is generated as ""county from"" and the location where the MTT product is applied as ""county to"".",256,,85,6
258,mtt3,Manure Treatment Low Heat Gasification,3,"Manure thermochemically reformulated at temperatures less than 1,500 degrees Fahrenheit in a low oxygen environment. Report units of dry tons and location where the manure is generated as ""county from"" and the location where the MTT product is applied as ""county to"".",256,,85,6
259,mtt4,Manure Treatment High Heat Gasification,3,"Manure thermochemically reformulated at temperatures between 1,500 and 2,730 degrees Fahrenheit in a low oxygen environment. Report units of dry tons and location where the manure is generated as ""county from"" and the location where the MTT product is applied as ""county to"".",256,,85,6
260,mtt5,Manure Treatment Combustion,3,"Manure combusted to produce heat without generating gas or liquid. Use when temperature is unknown. Report units of dry tons and location where the manure is generated as ""county from"" and the location where the MTT product is applied as ""county to"".",256,,85,6
261,mtt6,Manure Treatment High Heat Combustion,3,"Manure combusted to produce heat without generating gas or liquid. Temperature between 1,500 and 3,000 degrees Fahrenheit. Report units of dry tons and location where the manure is generated as ""county from"" and the location where the MTT product is applied as ""county to"".",256,,85,6
262,mtt7,Manure Treatment Rotating Bin,3,"Manure composted in n insulated silo, channel, or bin using a  controlled aeration system. Use this BMP where C:N is unknown. Report units of dry tons and location where the manure is generated as ""county from"" and the location where the MTT product is applied as ""county to"".",256,,85,6
263,mtt8,Manure Treatment Rotating Bin High CN,3,"Manure composted in an insulated silo, channel, or bin using a  controlled aeration system. The C:N is > 100. Report units of dry tons and location where the manure is generated as ""county from"" and the location where the MTT product is applied as ""county to"".",256,,85,6
264,mtt9,Manure Treatment Rotating Bin Low CN,3,"Manure composted in an insulated silo, channel, or bin using a  controlled aeration system. The C:N is < 100. Report units of dry tons and location where the manure is generated as ""county from"" and the location where the MTT product is applied as ""county to"".",256,,85,6
265,mtt10,Manure Treatment Forced Aeration,3,"Manure is composted using mechanical ventilation. Use this BMP where C:N is unknown. Report units of dry tons and location where the manure is generated as ""county from"" and the location where the MTT product is applied as ""county to"".",256,,85,6
266,mtt11,Manure Compost Forced Aeration High CN,3,"Manure is composted using mechanical ventilation. The C:N is > 100. Report units of dry tons and location where the manure is generated as ""county from"" and the location where the MTT product is applied as ""county to"".",256,,85,6
267,mtt12,Manure Compost Forced Aeration Low CN,3,"Manure is composted using mechanical ventilation. The C:N is < 100. Report units of dry tons and location where the manure is generated as ""county from"" and the location where the MTT product is applied as ""county to"".",256,,85,6
268,mtt13,Manure Compost Turned Pile Windrow,3,"Manure is composted using frequent turning. Use this BMP when the C:N is unknown. Report units of dry tons and location where the manure is generated as ""county from"" and the location where the MTT product is applied as ""county to"".",256,,85,6
269,mtt14,Manure Compost Turned Pile Windrow High CN,3,"Manure is composted using frequent turning. The C:N is > 100. Report units of dry tons and location where the manure is generated as ""county from"" and the location where the MTT product is applied as ""county to"".",256,,85,6
270,mtt15,Manure Compost Turned Pile Windrow LowCN,3,"Manure is composted using frequent turning. The C:N is < 100. Report units of dry tons and location where the manure is generated as ""county from"" and the location where the MTT product is applied as ""county to"".",256,,85,6
271,mtt16,Manure Compost Static Pile Windrow,3,"Manure is composted using natural aeration. Use this BMP when the C:N is unknown. Report units of dry tons and location where the manure is generated as ""county from"" and the location where the MTT product is applied as ""county to"".",256,,85,6
272,mtt17,Manure Compost Static Pile Windrow High CN,3,"Manure is composted using natural aeration. The C:N is > 100. Report units of dry tons and location where the manure is generated as ""county from"" and the location where the MTT product is applied as ""county to"".",256,,85,6
273,mtt18,Manure Compost Static Pile Windrow Low CN,3,"Manure is composted using natural aeration. The C:N is < 100. Report units of dry tons and location where the manure is generated as ""county from"" and the location where the MTT product is applied as ""county to"".",256,,85,6
274,mtt19,Manure Treatment Direct Monitor,3,Any manure treatment system that has monitoring data to determine the nitrogen load eliminated from the primary manure stream. Report units of both dry tons and pounds of TN.,256,,85,6
275,wetlandrestorefloodplain,Wetland Restoration - Floodplain,1,"Re-establish wetlands in a floodplain by manipulation of the physical, chemical, or biological characteristics of a site with the goal of returning natural/historic functions to a former wetland. Changes acres from existing land use to the wetland land use. Enter unit of total acres or percent of acres.",275,Wetland Restoration - Floodplain,60,1
276,wetlandrestoreheadwater,Wetland Restoration - Headwater,1,"Re-establish wetlands in a headwater area by manipulation of the physical, chemical, or biological characteristics of a site with the goal of returning natural/historic functions to a former wetland. Changes acres from existing land use to the wetland land use. Enter unit of total acres or percent of acres.",276,Wetland Restoration - Headwater,87,1
277,wetlandcreatefloodplain,Wetland Creation - Floodplain,1,"Establish or create wetlands in a floodplain by manipulation of the physical, chemical, or biological characteristics to develop a wetland where one did not previously exist. Changes acres from existing land use to the wetland land use. Enter unit of total acres or percent of acres.",277,Wetland Creation - Floodplain,88,1
278,wetlandcreateheadwater,Wetland Creation - Headwater,1,"Establish or create wetlands in a headwater area by manipulation of the physical, chemical, or biological characteristics to develop a wetland where one did not previously exist. Changes acres from existing land use to the wetland land use. Enter unit of total acres or percent of acres.",278,Wetland Creation - Headwater,89,1
279,wetlandenhance,Wetland Enhancement,1,"Enhance wetlands by manipulation of the physical, chemical, or biological characteristics of a site with the goal of heightening, intensifying or improving functions of a wetland. Provides a load reduction to the acres draining to the wetland. Enter unit of total acres or percent of acres enhanced.",279,Wetland Enhancement,90,1
280,wetlandrehabilitate,Wetland Rehabilitation,1,"Rehabilitate wetlands by manipulation of the physical, chemical, or biological characteristics of a site with the goal of returning natural/historic functions to a degraded wetland. Provides a load reduction to the acres draining to the wetland. Enter unit of total acres or percent of acres rehabilitated.",280,Wetland Rehabilitation,90,1
281,grassbuffexcleffn,Grass Buffer-Streamside with Exclusion Fencing Nitrogen Upland Acres,1,Upland area credited with a nitrogen load reduction as part of conversion of streamside pasture to open space and prevents livestock from entering the stream.  Acres of the upland area credited are determined by the acres entered as a land use change.,281,Grass Buffer-Streamside with Exclusion Fencing Nitrogen Upland Acres,22,3
282,grassbufferseffn,Grass Buffer Nitrogen Upland Acres,1,Upland area credited with a nitrogen load reduction as part of grass buffer installation.  Acres of the upland area credited are determined by the acres entered as a land use change.,282,Grass Buffer Nitrogen Upland Acres,22,3
283,forestbuffexcleffn,Forest Buffer-Streamside with Exclusion Fencing Nitrogen Upland Acres,1,Upland area credited with a nitrogen load reduction as part of conversion of streamside pasture to forest and prevents livestock from entering the stream.  Acres of the upland area credited are determined by the acres entered as a land use change.,283,Forest Buffer-Streamside with Exclusion Fencing Nitrogen Upland Acres,22,3
284,forestbufferseffn,Forest Buffer Nitrogen Upland Acres,1,Upland area credited with a nitrogen load reduction as part of conversion of forest buffer installation.  Acres of the upland area credited are determined by the acres entered as a land use change.,284,Forest Buffer Nitrogen Upland Acres,22,3
285,forestbufferseffps,Forest Buffer Phosphorus and Sediment Upland Acres,1,Upland area credited with a phosphorus and sediment load reduction as part of conversion of forest buffer installation.  Acres of the upland area credited are determined by the acres entered as a land use change.,285,Forest Buffer Phosphorus and Sediment Upland Acres,23,3
286,forestbufurbaneff,Urban Forest Buffer Upland Acres,1,"Upland area credited with a nitrogen, phosphorus and sediment load reduction as part of conversion of forest buffer installation.  Acres of the upland area credited are determined by the acres entered as a land use change.",286,Urban Forest Buffer Upland Acres,24,3
287,forestbuffexcleffps,Forest Buffer-Streamside with Exclusion Fencing Phosphorus and Sediment Upland Acres,1,Upland area credited with a phosphorus and sediment load reduction as part of conversion of streamside pasture to forest and prevents livestock from entering the stream.  Acres of the upland area credited are determined by the acres entered as a land use change.,287,Forest Buffer-Streamside with Exclusion Fencing Phosphorus and Sediment Upland Acres,23,3
288,grassbufferseffps,Grass Buffer Phosphorus and Sediment Upland Acres,1,Upland area credited with a phosphorus and sediment load reduction as part of grass buffer installation.  Acres of the upland area credited are determined by the acres entered as a land use change.,288,Grass Buffer Phosphorus and Sediment Upland Acres,23,3
289,grassbuffexcleffps,Grass Buffer-Streamside with Exclusion Fencing Phosphorus and Sediment Upland Acres,1,Upland area credited with a phosphorus and sediment load reduction as part of conversion of streamside pasture to open space and prevents livestock from entering the stream.  Acres of the upland area credited are determined by the acres entered as a land use change.,289,Grass Buffer-Streamside with Exclusion Fencing Phosphorus and Sediment Upland Acres,23,3
290,wetlandrestoreeff,Wetland Restoration Upland Acres,1,"Upland area credited with a load reduction as part of the re-establishment of wetlands by manipulation of the physical, chemical, or biological characteristics of a site with the goal of returning natural/historic functions to a former wetland. Acres of the upland area credited are determined by the acres entered as a land use change.",290,Wetland Restoration Upland Acres,22,3
291,wetlandcreateeff,Wetland Creation Upland Acres,1,"Upland area credited with a load reduction as part of the establishment or creation of wetlands by manipulation of the physical, chemical, or biological characteristics to develop a wetland where one did not previously exist.  Acres of the upland area credited are determined by the acres entered as a land use change.",291,Wetland Creation Upland Acres,22,3
292,wetlandenhanceeff,Wetland Enhancement Upland Acres,1,"Upland area credited with a load reduction as part of the enhancement of wetlands by manipulation of the physical, chemical, or biological characteristics of a site with the goal of heightening, intensifying or improving functions of a wetland.  Acres of the upland area credited are determined by the acres entered as a land use change.",292,Wetland Enhancement Upland Acres,22,3
293,wetlandrehabilitateeff,Wetland Rehabilitation Upland Acres,1,"Upland area credited with a load reduction as part of the rehabilitation of wetlands by manipulation of the physical, chemical, or biological characteristics of a site with the goal of returning natural/historic functions to a degraded wetland. Acres of the upland area credited are determined by the acres entered as a land use change.",293,Wetland Rehabilitation Upland Acres,22,3
294,diploidoysters2.25,Diploid Oyster Aquaculture 2.25 Inches,1,Private oyster aquaculture that is on- or off-bottom using hatchery-produced oysters or on-bottom using substrate addition. Use diploid if oyster type is unknown. The location is the finishing location if moved when shell < 2 inches; otherwise report the initial location. Enter units of number of oysters harvested.,294,Oyster Aquaculture,72,4
295,diploidoysters3,Diploid Oyster Aquaculture 3.0 Inches,1,Private oyster aquaculture that is on- or off-bottom using hatchery-produced oysters or on-bottom using substrate addition. Use diploid if oyster type is unknown. The location is the finishing location if moved when shell < 2 inches; otherwise report the initial location. Enter units of number of oysters harvested.,294,,72,4
296,diploidoysters4,Diploid Oyster Aquaculture 4.0 Inches,1,Private oyster aquaculture that is on- or off-bottom using hatchery-produced oysters or on-bottom using substrate addition. Use diploid if oyster type is unknown. The location is the finishing location if moved when shell < 2 inches; otherwise report the initial location. Enter units of number of oysters harvested.,294,,72,4
297,diploidoysters5,Diploid Oyster Aquaculture 5.0 Inches,1,Private oyster aquaculture that is on- or off-bottom using hatchery-produced oysters or on-bottom using substrate addition. Use diploid if oyster type is unknown. The location is the finishing location if moved when shell < 2 inches; otherwise report the initial location. Enter units of number of oysters harvested.,294,,72,4
298,diploidoysters6,Diploid Oyster Aquaculture Greater 6.0 Inches,1,Private oyster aquaculture that is on- or off-bottom using hatchery-produced oysters or on-bottom using substrate addition. Use diploid if oyster type is unknown. The location is the finishing location if moved when shell < 2 inches; otherwise report the initial location. Enter units of number of oysters harvested.,294,,72,4
299,triploidoysters2.25,Triploid Oyster Aquaculture 2.25 Inches,1,Private oyster aquaculture that is on- or off-bottom using hatchery-produced oysters or on-bottom using substrate addition. Use diploid if oyster type is unknown. The location is the finishing location if moved when shell < 2 inches; otherwise report the initial location. Enter units of number of oysters harvested.,294,,72,4
300,triploidoysters3,Triploid Oyster Aquaculture 3.0 Inches,1,Private oyster aquaculture that is on- or off-bottom using hatchery-produced oysters or on-bottom using substrate addition. Use diploid if oyster type is unknown. The location is the finishing location if moved when shell < 2 inches; otherwise report the initial location. Enter units of number of oysters harvested.,294,,72,4
301,triploidoysters4,Triploid Oyster Aquaculture 4.0 Inches,1,Private oyster aquaculture that is on- or off-bottom using hatchery-produced oysters or on-bottom using substrate addition. Use diploid if oyster type is unknown. The location is the finishing location if moved when shell < 2 inches; otherwise report the initial location. Enter units of number of oysters harvested.,294,,72,4
302,triploidoysters5,Triploid Oyster Aquaculture 5.0 Inches,1,Private oyster aquaculture that is on- or off-bottom using hatchery-produced oysters or on-bottom using substrate addition. Use diploid if oyster type is unknown. The location is the finishing location if moved when shell < 2 inches; otherwise report the initial location. Enter units of number of oysters harvested.,294,,72,4
